{"attempt":2,"evidenceDigest":"sha256:eeeeeeeeeeeeeeeeeeeeeeeeeeeeeeeeeeeeeeeeeeeeeeeeeeeeeeeeeeeeeeee","kind":"reasoning","previousLaunchDigest":"sha256:ffffffffffffffffffffffffffffffffffffffffffffffffffffffffffffffff","runId":"cb-retry-1111111111111111","schemaVersion":"compass-builder.retry-evidence.v1","source":"controller","storyId":"alpha"}
